[
 {
  "id": "offer-demo-cubemars",
  "part_id": null,
  "vendor": "CubeMars",
  "kind": "sponsor",
  "title": "首页赞助位（示例）",
  "detail": "此处为招商位：厂商可购买首页顶部展示。示例条目，请替换为真实合作信息。",
  "url": "https://www.cubemars.com/",
  "starts_on": "2026-10-01",
  "expires_on": "2026-12-31",
  "demo": true
 },
 {
  "id": "offer-demo-robstride",
  "part_id": null,
  "vendor": "灵足 RobStride",
  "kind": "sponsor",
  "title": "机型页赞助位（示例）",
  "detail": "整机方案页可挂厂商方案位。示例条目，请替换。",
  "url": "https://github.com/RobStride/Product_Information",
  "starts_on": "2026-10-01",
  "expires_on": "2026-12-31",
  "demo": true
 },
 {
  "id": "offer-demo-dm-coupon",
  "part_id": null,
  "vendor": "达妙 DM",
  "kind": "coupon",
  "title": "学生/创客优惠（示例）",
  "detail": "示例：凭学生证或开源项目链接可申请折扣码。请以厂商公告为准，此处仅演示结构。",
  "url": "https://www.hightorque.cn/",
  "starts_on": "2026-10-01",
  "expires_on": "2026-11-30",
  "demo": true
 },
 {
  "id": "offer-demo-bom",
  "part_id": null,
  "vendor": null,
  "kind": "giveaway",
  "title": "晒单返券（示例）",
  "detail": "示例：提交含实测数据的评论并通过审核，可参与抽奖。演示用。",
  "url": null,
  "starts_on": "2026-10-01",
  "expires_on": "2026-12-31",
  "demo": true
 }
]
