[
 {
  "id": "offer-slot-frontpage",
  "vendor": null,
  "part_id": null,
  "kind": "sponsor",
  "title": "首页展示位（招商中）",
  "price_cny": null,
  "detail": "厂商可申请首页/分类页展示位。本站不卖排名、不卖评分，展示位与评分排序完全分开，且必须标注「赞助」。",
  "url": null,
  "starts_on": null,
  "expires_on": null,
  "source": "本站规则",
  "demo": false
 }
]
