[
 {
  "id": "damiao-event-2ec",
  "vendor": "达妙 DM",
  "part_id": "达妙-dm-dm-j8009-2ec",
  "kind": "event",
  "title": "达妙大学生机器人竞赛采购优惠（2026）",
  "price_cny": 960,
  "detail": "大学生机器人竞赛（RM/RC 等）：每个参赛队伍、每个赛事、每个赛季限购 16 台；超出部分 999 元/台。RM 赛事参赛队伍：需使用报备的淘宝账号或邮件采购；RC 赛事参赛队伍：需提供有效参赛证明（组委会资格证明或相关官方文件）；其他机器人赛事可咨询官方优惠。线下联系人：周小姐 13560764159 / 微信 13730701033。",
  "url": "淘宝：达妙科技企业店 / 达妙智能控制企业店 / 达妙动力",
  "starts_on": "2026-09-07",
  "expires_on": "2027-08-31",
  "source": "达妙《关于大学生机器人竞赛电机采购优惠方案》",
  "demo": false
 },
 {
  "id": "damiao-event-2ec",
  "vendor": "达妙 DM",
  "part_id": "达妙-dm-dm-j8009p-2ec",
  "kind": "event",
  "title": "达妙大学生机器人竞赛采购优惠（2026）",
  "price_cny": 999,
  "detail": "大学生机器人竞赛：每队每赛事每赛季限购 16 台；超出部分 1080 元/台。RM 赛事参赛队伍：需使用报备的淘宝账号或邮件采购；RC 赛事参赛队伍：需提供有效参赛证明（组委会资格证明或相关官方文件）；其他机器人赛事可咨询官方优惠。线下联系人：周小姐 13560764159 / 微信 13730701033。",
  "url": "淘宝：达妙科技企业店 / 达妙智能控制企业店 / 达妙动力",
  "starts_on": "2026-09-07",
  "expires_on": "2027-08-31",
  "source": "达妙《关于大学生机器人竞赛电机采购优惠方案》",
  "demo": false
 },
 {
  "id": "damiao-event-1",
  "vendor": "达妙 DM",
  "part_id": "达妙-dm-dm-j8006-2ec-v1-1",
  "kind": "event",
  "title": "达妙大学生机器人竞赛采购优惠（2026）",
  "price_cny": 800,
  "detail": "大学生机器人竞赛：统一优惠价 800 元/台，不限购。RM 赛事参赛队伍：需使用报备的淘宝账号或邮件采购；RC 赛事参赛队伍：需提供有效参赛证明（组委会资格证明或相关官方文件）；其他机器人赛事可咨询官方优惠。线下联系人：周小姐 13560764159 / 微信 13730701033。",
  "url": "淘宝：达妙科技企业店 / 达妙智能控制企业店 / 达妙动力",
  "starts_on": "2026-09-07",
  "expires_on": "2027-08-31",
  "source": "达妙《关于大学生机器人竞赛电机采购优惠方案》",
  "demo": false
 },
 {
  "id": "damiao-event-2ec",
  "vendor": "达妙 DM",
  "part_id": "达妙-dm-dm-j10010l-2ec",
  "kind": "event",
  "title": "达妙大学生机器人竞赛采购优惠（2026）",
  "price_cny": 998,
  "detail": "参赛队伍优惠价 998 元/台（非参赛统一价 1049 元/台），不限购。RM 赛事参赛队伍：需使用报备的淘宝账号或邮件采购；RC 赛事参赛队伍：需提供有效参赛证明（组委会资格证明或相关官方文件）；其他机器人赛事可咨询官方优惠。线下联系人：周小姐 13560764159 / 微信 13730701033。",
  "url": "淘宝：达妙科技企业店 / 达妙智能控制企业店 / 达妙动力",
  "starts_on": "2026-09-07",
  "expires_on": "2027-08-31",
  "source": "达妙《关于大学生机器人竞赛电机采购优惠方案》",
  "demo": false
 },
 {
  "id": "damiao-event-2ec",
  "vendor": "达妙 DM",
  "part_id": "达妙-dm-dm-j10010-2ec",
  "kind": "event",
  "title": "达妙大学生机器人竞赛采购优惠（2026）",
  "price_cny": 1500,
  "detail": "参赛队伍优惠价 1500 元/台，不限购。RM 赛事参赛队伍：需使用报备的淘宝账号或邮件采购；RC 赛事参赛队伍：需提供有效参赛证明（组委会资格证明或相关官方文件）；其他机器人赛事可咨询官方优惠。线下联系人：周小姐 13560764159 / 微信 13730701033。",
  "url": "淘宝：达妙科技企业店 / 达妙智能控制企业店 / 达妙动力",
  "starts_on": "2026-09-07",
  "expires_on": "2027-08-31",
  "source": "达妙《关于大学生机器人竞赛电机采购优惠方案》",
  "demo": false
 },
 {
  "id": "damiao-event-2ec",
  "vendor": "达妙 DM",
  "part_id": "达妙-dm-dm-j6248p-2ec",
  "kind": "event",
  "title": "达妙大学生机器人竞赛采购优惠（2026）",
  "price_cny": 999,
  "detail": "参赛队伍优惠价 999 元/台，不限购。RM 赛事参赛队伍：需使用报备的淘宝账号或邮件采购；RC 赛事参赛队伍：需提供有效参赛证明（组委会资格证明或相关官方文件）；其他机器人赛事可咨询官方优惠。线下联系人：周小姐 13560764159 / 微信 13730701033。",
  "url": "淘宝：达妙科技企业店 / 达妙智能控制企业店 / 达妙动力",
  "starts_on": "2026-09-07",
  "expires_on": "2027-08-31",
  "source": "达妙《关于大学生机器人竞赛电机采购优惠方案》",
  "demo": false
 },
 {
  "id": "damiao-event-2",
  "vendor": "达妙 DM",
  "part_id": "达妙-dm-dm-j4310-2ec-v1-2",
  "kind": "event",
  "title": "达妙大学生机器人竞赛采购优惠（2026）",
  "price_cny": 539,
  "detail": "43 系列 4310 · 24V 版本 539 元/台（48V 版本 579 元/台）；每队每赛事每赛季每款型号限购 20 台。RM 赛事参赛队伍：需使用报备的淘宝账号或邮件采购；RC 赛事参赛队伍：需提供有效参赛证明（组委会资格证明或相关官方文件）；其他机器人赛事可咨询官方优惠。线下联系人：周小姐 13560764159 / 微信 13730701033。",
  "url": "淘宝：达妙科技企业店 / 达妙智能控制企业店 / 达妙动力",
  "starts_on": "2026-09-07",
  "expires_on": "2027-08-31",
  "source": "达妙《关于大学生机器人竞赛电机采购优惠方案》",
  "demo": false
 },
 {
  "id": "damiao-event-2ec",
  "vendor": "达妙 DM",
  "part_id": "达妙-dm-dm-j4310p-2ec",
  "kind": "event",
  "title": "达妙大学生机器人竞赛采购优惠（2026）",
  "price_cny": 629,
  "detail": "43 系列 4310P · 24V 版本 629 元/台（48V 版本 669 元/台）；每款型号限购 20 台。RM 赛事参赛队伍：需使用报备的淘宝账号或邮件采购；RC 赛事参赛队伍：需提供有效参赛证明（组委会资格证明或相关官方文件）；其他机器人赛事可咨询官方优惠。线下联系人：周小姐 13560764159 / 微信 13730701033。",
  "url": "淘宝：达妙科技企业店 / 达妙智能控制企业店 / 达妙动力",
  "starts_on": "2026-09-07",
  "expires_on": "2027-08-31",
  "source": "达妙《关于大学生机器人竞赛电机采购优惠方案》",
  "demo": false
 },
 {
  "id": "damiao-event-2ec",
  "vendor": "达妙 DM",
  "part_id": "达妙-dm-dm-j4340-2ec",
  "kind": "event",
  "title": "达妙大学生机器人竞赛采购优惠（2026）",
  "price_cny": 709,
  "detail": "43 系列 4340 · 24V 版本 709 元/台（48V 版本 749 元/台）；每款型号限购 20 台。RM 赛事参赛队伍：需使用报备的淘宝账号或邮件采购；RC 赛事参赛队伍：需提供有效参赛证明（组委会资格证明或相关官方文件）；其他机器人赛事可咨询官方优惠。线下联系人：周小姐 13560764159 / 微信 13730701033。",
  "url": "淘宝：达妙科技企业店 / 达妙智能控制企业店 / 达妙动力",
  "starts_on": "2026-09-07",
  "expires_on": "2027-08-31",
  "source": "达妙《关于大学生机器人竞赛电机采购优惠方案》",
  "demo": false
 },
 {
  "id": "damiao-event-2ec",
  "vendor": "达妙 DM",
  "part_id": "达妙-dm-dm-j4340p-2ec",
  "kind": "event",
  "title": "达妙大学生机器人竞赛采购优惠（2026）",
  "price_cny": 799,
  "detail": "43 系列 4340P · 24V 版本 799 元/台（48V 版本 829 元/台）；每款型号限购 20 台。RM 赛事参赛队伍：需使用报备的淘宝账号或邮件采购；RC 赛事参赛队伍：需提供有效参赛证明（组委会资格证明或相关官方文件）；其他机器人赛事可咨询官方优惠。线下联系人：周小姐 13560764159 / 微信 13730701033。",
  "url": "淘宝：达妙科技企业店 / 达妙智能控制企业店 / 达妙动力",
  "starts_on": "2026-09-07",
  "expires_on": "2027-08-31",
  "source": "达妙《关于大学生机器人竞赛电机采购优惠方案》",
  "demo": false
 }
]
