[
 {
  "id": "lingzu-edu-90",
  "vendor": "灵足 RobStride",
  "part_id": null,
  "kind": "edu",
  "title": "灵足教育优惠：一律 9 折",
  "price_cny": null,
  "discount": 0.9,
  "detail": "学生证或其他在读/在职教育证明均可，联系官方客服改价后下单；适用于灵足 RS / EL 全系。是否与其它活动叠加请与客服确认。",
  "url": "灵足时代官方客服",
  "starts_on": "2026-01-01",
  "expires_on": "2027-12-31",
  "source": "灵足官方（用户确认）",
  "demo": false
 }
]
